{
  "schema_version": 1,
  "card": "TC-175",
  "gate": "G2",
  "generated_by": "gatectl",
  "generated_at": "2026-10-04T09:48:48Z",
  "head_rev": "967b93e3b70df44cad6cd8530befd2ae5117779b",
  "missing": [
    "cmake",
    "msvc"
  ],
  "detail": "declared capabilities are absent on this host; no check was run"
}
